{
  "chunk_id": "neoforge_1.20.6_chunk_012",
  "version": "1.20.6",
  "loader": "neoforge",
  "category": "energy",
  "topic": "energy_transfer",
  "source_file": "net/neoforged/neoforge/energy/IEnergyStorage.java",
  "symbols": ["IEnergyStorage", "EnergyStorage", "EnergyTransfer", "EnergyUnit"],
  "topic_tags": ["energy", "storage"],
  "coverage_status": "verified",
  "line_count": 180,
  "description": "Energy transfer and storage system",
  "code_example": "// IEnergyStorage from IEnergyStorage.java\n"
}
