{
  "chunk_id": "neoforge_1.20.6_chunk_005",
  "version": "1.20.6",
  "loader": "neoforge",
  "category": "fluids",
  "topic": "fluid_systems",
  "source_file": "net/neoforged/neoforge/fluids/FluidType.java",
  "symbols": ["FluidType", "FluidStack", "IFluidBlock", "FluidAttributes"],
  "topic_tags": ["fluids", "handlers"],
  "coverage_status": "verified",
  "line_count": 620,
  "description": "Fluid handling system including fluid types, stacks, and handlers",
  "code_example": "// FluidType and FluidStack from fluids package\n"
}
