{
  "chunk_id": "chunk_019",
  "version": "1.20.1",
  "loader": "forge",
  "category": "server",
  "source_file": "net/minecraftforge/event/RegisterCommandsEvent.java",
  "symbols": ["RegisterCommandsEvent", "CommandDispatcher", "LiteralArgumentBuilder"],
  "coverage_status": "complete",
  "description": "Registering server commands",
  "code_example": "// Register custom commands\nMinecraftForge.EVENT_BUS.addListener(this::registerCommands);\n\nprivate void registerCommands(RegisterCommandsEvent event) {\n    CommandDispatcher<CommandSourceStack> dispatcher = event.getDispatcher();\n    \n    // Simple literal command\n    LiteralArgumentBuilder<CommandSourceStack> myCommand = Commands.literal(\"mymod\")\n        .requires(source -> source.hasPermission(2)) // Permission level\n        .then(Commands.literal(\"hello\")\n            .executes(context -> {\n                context.getSource().sendSuccess(\n                    new TextComponent(\"Hello from my mod!\"), true\n                );\n                return 1;\n            })\n        )\n        .then(Commands.literal(\"config\")\n            .then(Commands.argument(\"value\", IntegerArgumentType.integer())\n                .executes(context -> {\n                    int value = IntegerArgumentType.getInteger(context, \"value\");\n                    // Set config value\n                    return value;\n                })\n            )\n        );\n    \n    dispatcher.register(myCommand);\n}"
}
