{
  "chunk_id": "chunk-025",
  "version": "1.20.4",
  "loader": "kubejs",
  "category": "script",
  "source_file": "script/ScriptManager.java",
  "symbols": ["ScriptManager", "ScriptEventJS"],
  "coverage_status": "complete",
  "description": "Script management and events",
  "topics": ["scripts", "javascript", "startup"]
}
