{
  "chunk_id": "nf-1.21.1-017",
  "version": "1.21.1",
  "loader": "neoforge",
  "category": "server",
  "source_files": [
    "net/neoforged/neoforge/server/command/generation/CoarseOnionIterator.java",
    "net/neoforged/neoforge/server/command/CommandHelper.java",
    "net/neoforged/neoforge/server/command/CommandUtils.java",
    "net/neoforged/neoforge/server/command/ConfigCommand.java",
    "net/neoforged/neoforge/server/console/ConsoleCommandCompleter.java",
    "net/neoforged/neoforge/server/command/DataComponentCommand.java",
    "net/neoforged/neoforge/server/permission/handler/DefaultPermissionHandler.java",
    "net/neoforged/neoforge/server/command/DimensionsCommand.java",
    "net/neoforged/neoforge/server/command/DumpCommand.java",
    "net/neoforged/neoforge/server/command/EntityCommand.java",
    "net/neoforged/neoforge/server/command/EnumArgument.java",
    "net/neoforged/neoforge/server/command/GenerateCommand.java",
    "net/neoforged/neoforge/server/command/generation/GenerationBar.java",
    "net/neoforged/neoforge/server/command/generation/GenerationTask.java",
    "net/neoforged/neoforge/server/permission/handler/IPermissionHandler.java"
  ],
  "symbols": [
    "CoarseOnionIterator",
    "CommandHelper",
    "CommandUtils",
    "ConfigCommand",
    "ConsoleCommandCompleter",
    "DataComponentCommand",
    "DefaultPermissionHandler",
    "DimensionsCommand",
    "DumpCommand",
    "EntityCommand",
    "EnumArgument",
    "GenerateCommand",
    "GenerationBar",
    "GenerationTask",
    "IPermissionHandler"
  ],
  "description": "Server commands and execution",
  "topic_tags": ["server", "commands", "permissions"],
  "code_example": "// Command helpers and permission handlers are in net.neoforged.neoforge.server.*\n",
  "coverage_status": "verified"
}
