{
  "chunk_id": "kubejs_1.21.1_008",
  "version": "1.21.1",
  "loader": "kubejs",
  "category": "recipe_event",
  "source_file": "/Users/agenthome/mc-code-exports/1.21.1/kubejs/sources/dev/latvian/mods/kubejs/recipe/RecipesKubeEvent.java",
  "symbols": ["RecipesKubeEvent", "recipeSchemaStorage", "registries", "addedRecipes", "removedRecipes", "shaped", "shapeless", "smelting", "blasting", "smoking", "campfireCooking"],
  "topic_tags": ["kubejs", "recipes", "events"],
  "coverage_status": "verified",
  "code": "public class RecipesKubeEvent implements KubeEvent {\n\tprivate final Stopwatch overallTimer;\n\n\tpublic final RecipeSchemaStorage recipeSchemaStorage;\n\tpublic final RegistryAccessContainer registries;\n\tpublic final ResourceManager resourceManager;\n\tpublic final RegistryOpsContainer ops;\n\tpublic final Map<ResourceLocation, KubeRecipe> originalRecipes;\n\tpublic final Collection<KubeRecipe> addedRecipes;\n\tpublic final Collection<KubeRecipe> removedRecipes;\n\n\tint modifiedCount, failedCount;\n\n\tprivate final Map<ResourceLocation, KubeRecipe> takenIds;\n\n\tprivate final Map<String, Object> recipeFunctions;\n\tpublic final transient RecipeTypeFunction vanillaShaped;\n\tpublic final transient RecipeTypeFunction vanillaShapeless;\n\tpublic final RecipeTypeFunction shaped;\n\tpublic final RecipeTypeFunction shapeless;\n\tpublic final RecipeTypeFunction smelting;\n\tpublic final RecipeTypeFunction blasting;\n\tpublic final RecipeTypeFunction smoking;\n\tpublic final RecipeTypeFunction campfireCooking;\n}",
  "code_example": "// RecipesKubeEvent fields from RecipesKubeEvent.java\n"
}
