{
  "chunk_id": "minecraft-1.20.4-blocks-001",
  "version": "1.20.4",
  "loader": "minecraft",
  "category": "blocks",
  "source_files": [
    "net/minecraft/world/level/block/Block.java",
    "net/minecraft/world/level/block/state/BlockState.java",
    "net/minecraft/world/level/block/state/BlockBehaviour.java"
  ],
  "symbols": [
    {
      "name": "Block",
      "signature": "class Block extends BlockBehaviour implements ItemLike",
      "description": "Base block type and core interaction hooks"
    },
    {
      "name": "BlockState",
      "signature": "class BlockState extends BlockBehaviour.BlockStateBase",
      "description": "Immutable state holder for a block"
    },
    {
      "name": "BlockBehaviour.Properties",
      "signature": "static class BlockBehaviour.Properties",
      "description": "Fluent builder for block settings"
    },
    {
      "name": "Block.defaultBlockState",
      "signature": "BlockState defaultBlockState()",
      "description": "Default state for new blocks"
    }
  ],
  "code_example": "// Custom block with properties\npublic class MyBlock extends Block {\n    public MyBlock() {\n        super(BlockBehaviour.Properties.of()\n            .strength(2.0F, 6.0F)\n            .sound(SoundType.STONE)\n        );\n    }\n}\n",
  "topic_tags": ["blocks", "blockstate", "properties"],
  "coverage_status": "verified"
}
