{
  "chunk_id": "nf-1.21.1-004",
  "version": "1.21.1",
  "loader": "neoforge",
  "category": "client",
  "source_files": [
    "net/neoforged/neoforge/client/event/AddAttributeTooltipsEvent.java",
    "net/neoforged/neoforge/client/event/AddSectionGeometryEvent.java",
    "net/neoforged/neoforge/client/entity/animation/json/AnimationHolder.java",
    "net/neoforged/neoforge/client/entity/animation/AnimationKeyframeTarget.java",
    "net/neoforged/neoforge/client/entity/animation/json/AnimationLoader.java",
    "net/neoforged/neoforge/client/entity/animation/json/AnimationParser.java",
    "net/neoforged/neoforge/client/entity/animation/AnimationTarget.java",
    "net/neoforged/neoforge/client/entity/animation/json/AnimationTypeManager.java",
    "net/neoforged/neoforge/client/model/renderable/BakedModelRenderable.java",
    "net/neoforged/neoforge/client/model/BakedModelWrapper.java",
    "net/neoforged/neoforge/client/BlockEntityRenderBoundsDebugRenderer.java",
    "net/neoforged/neoforge/client/model/geometry/BlockGeometryBakingContext.java",
    "net/neoforged/neoforge/client/model/generators/BlockModelBuilder.java",
    "net/neoforged/neoforge/client/model/generators/BlockModelProvider.java",
    "net/neoforged/neoforge/client/model/generators/BlockStateProvider.java"
  ],
  "symbols": [
    "AddAttributeTooltipsEvent",
    "AddSectionGeometryEvent",
    "AnimationHolder",
    "AnimationKeyframeTarget",
    "AnimationLoader",
    "AnimationParser",
    "AnimationTarget",
    "AnimationTypeManager",
    "BakedModelRenderable",
    "BakedModelWrapper",
    "BlockEntityRenderBoundsDebugRenderer",
    "BlockGeometryBakingContext",
    "BlockModelBuilder",
    "BlockModelProvider",
    "BlockStateProvider"
  ],
  "description": "Client events and handling",
  "topic_tags": ["client", "rendering", "models", "tooltips", "animation"],
  "code_example": "// Client event hooks and model generation helpers.\n// Use BlockModelProvider/BlockStateProvider in data generation.\n",
  "coverage_status": "verified"
}
