{
  "chunk_id": "neoforge_1.20.6_chunk_008",
  "version": "1.20.6",
  "loader": "neoforge",
  "category": "attachment",
  "topic": "attachment_system",
  "source_file": "net/neoforged/neoforge/attachment/AttachmentHolder.java",
  "symbols": ["AttachmentHolder", "AttachmentType", "AttachmentTypeBuilder", "AttachmentInternals"],
  "topic_tags": ["attachments", "data", "sync"],
  "coverage_status": "verified",
  "line_count": 280,
  "description": "Attachment system for persistent entity and item data",
  "code_example": "// AttachmentHolder and AttachmentType from attachment package\n"
}
